{
  "version": "2.1.0",
  "build": "76",
  "notes": "- 优化保险库首页、编辑页和详情页，沿用拾器设计规范；支持多关键词搜索、逐条网址、实时验证码和名称排序，保留原有顶导和底导。\n- 新增 B站视频下载，支持选分P、兼容有声视频、音频、封面及可用字幕；提供任务重试、本机预览、文件导出和相册保存，并显示保存进度。\n- 新增自定义字段、条目复制、最近 5 次密码历史、30 天本机回收站、多选整理与嵌套文件夹。\n- 新增密码生成完整参数、中英短语、用户名生成和最多 50 条本机生成记录，生成结果写入钥匙串后才展示。\n- 修复回收站容量影响同步的问题；完整加密备份保留条目新字段，CSV 和系统交换不包含自定义字段与密码历史。\n\n回收站仅在本机保留，最多 100 项；生成记录与参数也不参与备份或同步。系统填充、通行密钥与 Apple 交换仍受签名限制，未完成真机验收。本次沿用兼容签名测试方式，仅支持证书登记设备。\n\n视频下载首版只支持匿名 B站普通投稿，抖音／快手／平台账号与后台持续下载尚未开放；后台或离开工具会停止未完成任务，已完成文件保留。",
  "installURL": "itms-services://?action=download-manifest&url=https://www.pgyer.com/app/plist/8ad61626ddca24d4edc1e2830779575e",
  "publishedAt": "2026-10-24T23:28:30.371Z"
}
